{
  "schemaVersion": 1,
  "updatedAt": "2026-08-22T08:21:57.035Z",
  "storage": {
    "mode": "local-only",
    "remoteProvider": null,
    "remoteBucket": null,
    "policy": "No external upload before provider, license, lifecycle and credential review"
  },
  "indexes": [
    {
      "id": "production-asset-manifest",
      "path": "public/assets/manifests/asset_manifest.json",
      "sha256": "84406a2a36bc42c21c89dde9a5e7ecc5d11d38cd489fca92b11e3f704fe8dc0f"
    },
    {
      "id": "original-14-family-complete-visual-inventory-20260814",
      "path": "requirements/active/art-approval-matrix-p1-20260814/evidence/original-14-family-complete-visual-inventory-20260814.json",
      "sha256": "6fb062a24d0117c9a0d9bfdd2d2771812996ebdbbd0102f3d0e583eb09ed5bea"
    },
    {
      "id": "external-layered-source-structure-audit-20260814",
      "path": "requirements/active/external-assets-audit-p1-20260813/evidence/external-layered-source-structure-audit-20260814.json",
      "sha256": "382a3849d0caa98bd503b0a5842724c8aeace26b108dbe13751aace1f23a1660"
    },
    {
      "id": "external-psd-secondary-parser-verification-20260814",
      "path": "requirements/active/external-assets-audit-p1-20260813/evidence/external-psd-secondary-parser-verification-20260814.json",
      "sha256": "a6acbd5aa6d5b0d05216c58f39004099f17206a853d9b6a20f42e9a21007ff90"
    }
  ],
  "collections": [
    {
      "id": "avatar-v2",
      "category": "platform/avatar",
      "catalogPath": "public/assets/avatars/v2/avatar_catalog_v2.json",
      "catalogSha256": "b4b8263c1cb19956e7988da247f2ee735c4baf952550b1d91f8d94a457cd4d35",
      "licensePath": null,
      "licenseSha256": null,
      "masterRoot": "art-source/platform/avatars/v2",
      "previewPath": "art-source/platform/avatars/v2/avatar_catalog_preview.jpg",
      "sourceType": "generated",
      "license": "project-owned-ai-generated",
      "status": "integrated-local-only",
      "remoteObjectKey": null
    },
    {
      "id": "background-v1",
      "category": "platform/background",
      "catalogPath": "public/assets/backgrounds/v1/background_catalog_v1.json",
      "catalogSha256": "c84017dd029aed630b97907ebe26aec7e7a2e3bb131662e6738fc3bcfa74cf67",
      "licensePath": null,
      "licenseSha256": null,
      "masterRoot": "art-source/platform/backgrounds/v1",
      "previewPath": "public/assets/backgrounds/v1/pixel/pixel_mini.webp",
      "sourceType": "generated",
      "license": "project-owned-ai-generated",
      "status": "integrated-local-only",
      "remoteObjectKey": null
    },
    {
      "id": "ui-icons-v1",
      "category": "platform/icon",
      "catalogPath": "public/assets/icons/ui/SOURCE.md",
      "catalogSha256": "b579f3efc702a272e684d0858ae7310332b4a00b10eb22960c4e90a00e257399",
      "licensePath": "public/assets/icons/ui/LICENSE",
      "licenseSha256": "6fc5b7332939dd5c61af3a5f97450f7bc05d4a396dd0bc21ac341716b3b05096",
      "masterRoot": "public/assets/icons/ui",
      "previewPath": "public/assets/icons/ui/gamepad-2.svg",
      "sourceType": "external-licensed",
      "sourceUrl": "https://github.com/lucide-icons/lucide",
      "license": "Lucide ISC with Feather-derived MIT notices",
      "status": "integrated-local-only",
      "remoteObjectKey": null
    },
    {
      "id": "sticker-cartoon-m0-draft",
      "category": "style/golden-set",
      "catalogPath": "art-source/style/golden-set-source-manifest-v2.json",
      "catalogSha256": "97e2b4ab4225492961b606b03577020700e5791e155dc96e5661725b2af4693a",
      "licensePath": null,
      "licenseSha256": null,
      "masterRoot": "art-source",
      "previewPath": "art-source/ui/sticker-v1/component-demo.png",
      "sourceType": "project-owned",
      "license": "project-owned and project-owned-ai-generated; per-asset provenance in Source Manifest v2",
      "status": "reference-only",
      "remoteObjectKey": null
    },
    {
      "id": "seasonal-backgrounds-v1",
      "category": "platform/background",
      "catalogPath": "public/assets/backgrounds/seasonal-v1/background_catalog_v1.json",
      "catalogSha256": "01e9ba13bb876d69ddc0685ea1df16fd4fbc5867daf0c21e5f97f5c5b91a0052",
      "licensePath": null,
      "licenseSha256": null,
      "masterRoot": "art-source/platform/backgrounds/seasonal-v1",
      "previewPath": "art-source/platform/backgrounds/seasonal-v1/review/seasonal-backgrounds-contact-sheet-v1.png",
      "sourceType": "generated",
      "license": "project-owned-ai-generated",
      "status": "integrated-local-only",
      "remoteObjectKey": null
    }
  ],
  "assets": [
    {
      "id": "ART-026-GCOINS-P1-CANDIDATE-B",
      "category": "platform/currency",
      "assetType": "currency-icon-source-candidate",
      "sourceType": "generated",
      "sourcePath": "art-source/brand/ghost-game/currency/gcoins-p1-20260814/source/gcoins-p1-candidate-b-chroma.png",
      "sourceSha256": "6a99bea413410f62520a2abe16ce3ab341c9e0337bd21a383350fc9f578dd04a",
      "license": "project-owned-ai-generated",
      "author": "OpenAI Codex for Ghost Game",
      "status": "reference-only",
      "dimensions": {
        "width": 1254,
        "height": 1254
      },
      "previewPath": "art-source/brand/ghost-game/currency/gcoins-p1-20260814/alpha/gcoins-p1-candidate-b-alpha.png",
      "previewSha256": "d62909d4827d427d5e499299fb2a7e839866a3ddc9e7b701d53c3e1cc542854c",
      "runtimePaths": [
        "art-source/brand/ghost-game/currency/gcoins-p1-20260814/alpha/gcoins-p1-candidate-b-alpha.png",
        "art-source/brand/ghost-game/currency/gcoins-p1-20260814/derived/gcoins-p1-candidate-b-192px.png",
        "art-source/brand/ghost-game/currency/gcoins-p1-20260814/derived/gcoins-p1-candidate-b-96px.png",
        "art-source/brand/ghost-game/currency/gcoins-p1-20260814/derived/gcoins-p1-candidate-b-64px.png",
        "art-source/brand/ghost-game/currency/gcoins-p1-20260814/derived/gcoins-p1-candidate-b-44px.png"
      ],
      "promptPath": "art-source/brand/ghost-game/currency/gcoins-p1-20260814/PROMPT_AND_PROVENANCE.md",
      "model": "highest-quality-built-in-imagegen-runtime-managed",
      "remoteObjectKey": null
    },
    {
      "id": "ART-026-GCOINS-SOURCE-CHROMA-V1",
      "category": "platform/currency",
      "assetType": "currency-icon-source-candidate",
      "sourceType": "generated",
      "sourcePath": "art-source/brand/ghost-game/currency/gcoins-p0-20260810/gcoins-source-chroma-v1.png",
      "sourceSha256": "9d6d8870329b04b5a136f66449498656b7601bee15afbdabc2a73eaa030919ad",
      "license": "project-owned-ai-generated",
      "author": "OpenAI Codex for Ghost Game",
      "status": "reference-only",
      "dimensions": {
        "width": 1254,
        "height": 1254
      },
      "previewPath": "art-source/brand/ghost-game/currency/gcoins-p0-20260810/gcoins-source-chroma-v1.png",
      "previewSha256": "9d6d8870329b04b5a136f66449498656b7601bee15afbdabc2a73eaa030919ad",
      "runtimePaths": [
        "art-source/brand/ghost-game/currency/gcoins-p0-20260810/gcoins-source-chroma-v1.png"
      ],
      "promptPath": "art-source/brand/ghost-game/currency/gcoins-p0-20260810/PROMPT_AND_PROVENANCE.md",
      "model": "highest-quality-built-in-imagegen-runtime-managed",
      "remoteObjectKey": null
    },
    {
      "id": "BRAND-HONRU-CHARACTER-MASTER-V2-DRAFT",
      "category": "brand/honru",
      "assetType": "character-master-candidate",
      "sourceType": "generated",
      "sourcePath": "art-source/brand/ghost-game/honru/v2/chroma/honru-character-master-v2-chroma-draft-v1.png",
      "sourceSha256": "1f4a02bfbce503fd91cb0228e7da6dff4069443cdfeda6bf17ba9ccf301790eb",
      "license": "project-owned-ai-generated",
      "author": "OpenAI Codex for Ghost Game",
      "status": "reference-only",
      "dimensions": {
        "width": 1254,
        "height": 1254
      },
      "previewPath": "art-source/brand/ghost-game/honru/v2/honru-character-master-v2-flat-transparent-draft-v1.png",
      "previewSha256": "9b9bd08f109ef83ba1da19007a6965d3caed3e3fa66b2a9a027c0120044fe971",
      "runtimePaths": [
        "art-source/brand/ghost-game/honru/v2/honru-character-master-v2-flat-transparent-draft-v1.png",
        "art-source/brand/ghost-game/honru/v2/derived/honru-character-master-v2-192px-draft-v1.png",
        "art-source/brand/ghost-game/honru/v2/derived/honru-character-master-v2-96px-draft-v1.png",
        "art-source/brand/ghost-game/honru/v2/derived/honru-character-master-v2-64px-draft-v1.png",
        "art-source/brand/ghost-game/honru/v2/derived/honru-character-master-v2-44px-draft-v1.png"
      ],
      "promptPath": "art-source/brand/ghost-game/honru/v2/PROMPT_AND_PROVENANCE_v2.md",
      "model": "codex-built-in-imagegen-runtime-managed",
      "remoteObjectKey": null
    },
    {
      "id": "BRAND-HONRU-STATE-CHECK-IN-V1-DRAFT",
      "category": "brand/honru/state",
      "assetType": "character-expression-candidate",
      "sourceType": "generated",
      "sourcePath": "art-source/brand/ghost-game/honru/states-v1/chroma/honru-check-in-chroma-draft-v1.png",
      "sourceSha256": "a7fee0d0976a000e7786de6e512873ff23a198848b4b7474b7e4dd68050d5464",
      "license": "project-owned-ai-generated",
      "author": "OpenAI Codex for Ghost Game",
      "status": "reference-only",
      "dimensions": {
        "width": 1254,
        "height": 1254
      },
      "previewPath": "art-source/brand/ghost-game/honru/states-v1/flat/honru-check-in-flat-draft-v1.png",
      "previewSha256": "b4bebe1c18837211b932cbdbfeb4a98724a8a8c32a4bf1450ed5e1ea61fa357c",
      "runtimePaths": [
        "art-source/brand/ghost-game/honru/states-v1/flat/honru-check-in-flat-draft-v1.png",
        "art-source/brand/ghost-game/honru/states-v1/derived/honru-check-in-flat-draft-v1-192px.png",
        "art-source/brand/ghost-game/honru/states-v1/derived/honru-check-in-flat-draft-v1-96px.png",
        "art-source/brand/ghost-game/honru/states-v1/derived/honru-check-in-flat-draft-v1-64px.png",